{
  "$schema": "https://json-schema.org/draft/2020-12/schema",
  "$id": "https://schemas.conductorone.com/multipass/secret-contracts/v1/ssh_key.schema.json",
  "title": "ssh_key",
  "x-secret-content-type": "ssh_key",
  "description": "An SSH private key with optional public key, certificate, username, hosts and passphrase.",
  "type": "object",
  "additionalProperties": false,
  "required": [
    "private_key"
  ],
  "properties": {
    "private_key": {
      "type": "string",
      "minLength": 1,
      "maxLength": 131072,
      "x-max-utf8-bytes": 131072,
      "x-semantic": [
        "ssh_private_key"
      ]
    },
    "username": {
      "type": "string",
      "minLength": 1,
      "maxLength": 256,
      "x-max-utf8-bytes": 131072,
      "x-semantic": [
        "ssh_username"
      ]
    },
    "passphrase": {
      "type": "string",
      "minLength": 1,
      "maxLength": 4096,
      "x-max-utf8-bytes": 131072
    },
    "public_key": {
      "type": "string",
      "minLength": 1,
      "maxLength": 131072,
      "x-max-utf8-bytes": 131072,
      "x-semantic": [
        "ssh_public_key"
      ]
    },
    "hosts": {
      "type": "array",
      "items": {
        "minLength": 1,
        "type": "string",
        "x-max-utf8-bytes": 4096
      },
      "maxItems": 64,
      "uniqueItems": true
    },
    "ssh_certificate": {
      "type": "string",
      "minLength": 1,
      "maxLength": 131072,
      "x-max-utf8-bytes": 131072,
      "x-semantic": [
        "ssh_certificate"
      ]
    }
  },
  "x-max-document-bytes": 524288
}
