{"\u0070\u0072\u0069\u0076\u0061\u0074\u0065\u005f\u006b\u0065\u0079":"\u002d\u002d\u002d\u002d\u002d\u0042\u0045\u0047\u0049\u004e\u0020\u004f\u0050\u0045\u004e\u0053\u0053\u0048\u0020\u0050\u0052\u0049\u0056\u0041\u0054\u0045\u0020\u004b\u0045\u0059\u002d\u002d\u002d\u002d\u002d\u000a\u0062\u0033\u0042\u006c\u0062\u006e\u004e\u007a\u0061\u0043\u0031\u0072\u005a\u0058\u006b\u0074\u0064\u006a\u0045\u0041\u0041\u0041\u0041\u0041\u0042\u0047\u0035\u0076\u0062\u006d\u0055\u0041\u0041\u0041\u0041\u0045\u0062\u006d\u0039\u0075\u005a\u0051\u0041\u0041\u0041\u0041\u0041\u0041\u0041\u0041\u0041\u0042\u0041\u0041\u0041\u0041\u004d\u0077\u0041\u0041\u0041\u0041\u0074\u007a\u0063\u0032\u0067\u0074\u005a\u0057\u000a\u0051\u0079\u004e\u0054\u0055\u0078\u004f\u0051\u0041\u0041\u0041\u0043\u0044\u0067\u006f\u0069\u0064\u0055\u0067\u006d\u0038\u0067\u004d\u0059\u0074\u0054\u006a\u0031\u004a\u002f\u0074\u006c\u0044\u0062\u0064\u004e\u0031\u006d\u0057\u0063\u006d\u0069\u0061\u004a\u006a\u002b\u0046\u0063\u006a\u0031\u0037\u0064\u0046\u005a\u002b\u0041\u0041\u0041\u0041\u004a\u0068\u0035\u004d\u0073\u0048\u0056\u0065\u0054\u004c\u0042\u000a\u0031\u0051\u0041\u0041\u0041\u0041\u0074\u007a\u0063\u0032\u0067\u0074\u005a\u0057\u0051\u0079\u004e\u0054\u0055\u0078\u004f\u0051\u0041\u0041\u0041\u0043\u0044\u0067\u006f\u0069\u0064\u0055\u0067\u006d\u0038\u0067\u004d\u0059\u0074\u0054\u006a\u0031\u004a\u002f\u0074\u006c\u0044\u0062\u0064\u004e\u0031\u006d\u0057\u0063\u006d\u0069\u0061\u004a\u006a\u002b\u0046\u0063\u006a\u0031\u0037\u0064\u0046\u005a\u002b\u0041\u000a\u0041\u0041\u0041\u0045\u0043\u004a\u0064\u006b\u0055\u0071\u0048\u0059\u006e\u0056\u0061\u006d\u0074\u0053\u0036\u0071\u002b\u0039\u0065\u0043\u0056\u0069\u0070\u0062\u0068\u0030\u0059\u0058\u0072\u0058\u0061\u004d\u0076\u0044\u005a\u006a\u0067\u0059\u0064\u0072\u005a\u0042\u0045\u0075\u0043\u0069\u004a\u0031\u0053\u0043\u0062\u0079\u0041\u0078\u0069\u0031\u004f\u0050\u0055\u006e\u002b\u0032\u0055\u004e\u0074\u0030\u000a\u0033\u0057\u005a\u005a\u0079\u0061\u004a\u006f\u006d\u0050\u0034\u0056\u0079\u0050\u0058\u0074\u0030\u0056\u006e\u0034\u0041\u0041\u0041\u0041\u0046\u0048\u0052\u0035\u0063\u0047\u0056\u006b\u004c\u0058\u004e\u006c\u0059\u0033\u004a\u006c\u0064\u0043\u0031\u006d\u0061\u0058\u0068\u0030\u0064\u0058\u004a\u006c\u0041\u0051\u003d\u003d\u000a\u002d\u002d\u002d\u002d\u002d\u0045\u004e\u0044\u0020\u004f\u0050\u0045\u004e\u0053\u0053\u0048\u0020\u0050\u0052\u0049\u0056\u0041\u0054\u0045\u0020\u004b\u0045\u0059\u002d\u002d\u002d\u002d\u002d\u000a","\u0075\u0073\u0065\u0072\u006e\u0061\u006d\u0065":"\u0064\u0065\u0070\u006c\u006f\u0079","\u0070\u0061\u0073\u0073\u0070\u0068\u0072\u0061\u0073\u0065":"\u0075\u006e\u0075\u0073\u0065\u0064","\u0070\u0075\u0062\u006c\u0069\u0063\u005f\u006b\u0065\u0079":"\u0073\u0073\u0068\u002d\u0065\u0064\u0032\u0035\u0035\u0031\u0039\u0020\u0041\u0041\u0041\u0041\u0043\u0033\u004e\u007a\u0061\u0043\u0031\u006c\u005a\u0044\u0049\u0031\u004e\u0054\u0045\u0035\u0041\u0041\u0041\u0041\u0049\u004f\u0043\u0069\u004a\u0031\u0053\u0043\u0062\u0079\u0041\u0078\u0069\u0031\u004f\u0050\u0055\u006e\u002b\u0032\u0055\u004e\u0074\u0030\u0033\u0057\u005a\u005a\u0079\u0061\u004a\u006f\u006d\u0050\u0034\u0056\u0079\u0050\u0058\u0074\u0030\u0056\u006e\u0034\u0020\u0074\u0079\u0070\u0065\u0064\u002d\u0073\u0065\u0063\u0072\u0065\u0074\u002d\u0066\u0069\u0078\u0074\u0075\u0072\u0065","\u0068\u006f\u0073\u0074\u0073":["\u0061\u002e\u0065\u0078\u0061\u006d\u0070\u006c\u0065\u002e\u0063\u006f\u006d","\u0062\u002e\u0065\u0078\u0061\u006d\u0070\u006c\u0065\u002e\u0063\u006f\u006d"]}