{"hosts":["a.example.com","b.example.com"],"public_key":"ssh-ed25519 AAAAC3NzaC1lZDI1NTE5AAAAIOCiJ1SCbyAxi1OPUn+2UNt03WZZyaJomP4VyPXt0Vn4 typed-secret-fixture","passphrase":"unused","username":"deploy","private_key":"-----BEGIN OPENSSH PRIVATE KEY-----\nb3BlbnNzaC1rZXktdjEAAAAABG5vbmUAAAAEbm9uZQAAAAAAAAABAAAAMwAAAAtzc2gtZW\nQyNTUxOQAAACDgoidUgm8gMYtTj1J/tlDbdN1mWcmiaJj+Fcj17dFZ+AAAAJh5MsHVeTLB\n1QAAAAtzc2gtZWQyNTUxOQAAACDgoidUgm8gMYtTj1J/tlDbdN1mWcmiaJj+Fcj17dFZ+A\nAAAECJdkUqHYnVamtS6q+9eCVipbh0YXrXaMvDZjgYdrZBEuCiJ1SCbyAxi1OPUn+2UNt0\n3WZZyaJomP4VyPXt0Vn4AAAAFHR5cGVkLXNlY3JldC1maXh0dXJlAQ==\n-----END OPENSSH PRIVATE KEY-----\n"}